{
  "blocker": {
    "code": "JAVAC_ZIPFS_ACCESSDENIED_ON_CLOSE_JAR",
    "detail": "Implementation and static gates are complete, but Maven compile/JUnit verification is infrastructure-blocked. Maven initially resolved user.home to C:\\ and failed to create C:\\.m2; after MAVEN_OPTS forced user.home to C:\\Users\\小白, javac repeatedly failed with java.nio.file.AccessDeniedException while closing dependency jars via ZipFS, under both C:\\Users\\小白\\.m2\\repository and a workspace-local Maven repository. The explicit PostgreSQL env vars are present, but psql/docker and Python PostgreSQL drivers are not available for a non-Maven database execution fallback.",
    "paths": [
      "C:\\Users\\小白\\.m2\\repository\\com\\fasterxml\\jackson\\core\\jackson-annotations\\2.21\\jackson-annotations-2.21.jar",
      "C:\\Users\\小白\\.m2\\repository\\software\\amazon\\awssdk\\auth\\2.48.3\\auth-2.48.3.jar",
      "services/backend/target/hhy-m2-repo/com/fasterxml/jackson/core/jackson-annotations/2.21/jackson-annotations-2.21.jar"
    ],
    "resolution": "Repair local Java/Maven filesystem access for jar ZipFS close or provide psql/docker/Python PostgreSQL driver fallback, then rerun mvn -q -f services/backend/pom.xml -DskipTests install and mvn -q -f services/backend/pom.xml -pl boot -Dtest=R15NotificationSupportMigrationTest test.",
    "worker_result_evidence": "Static gates passed: python -m pytest -q tests/test_r15_database_contract.py -> 5 passed; python3 scripts/check_db_schema.py -> DB_SCHEMA_OK tables=203 migrations=48 runtime_hashes=PASS. Maven/JUnit blocked by AccessDeniedException on dependency jar close."
  },
  "changed_files": [
    "database/migrations/V048__r15_notification_support_invariants.sql",
    "database/rollback/U048__r15_notification_support_invariants_DEV_ONLY.sql",
    "database/tests/r15_notification_support_invariants.sql",
    "docs/01-architecture/adr/ADR-010-R15通知客服数据不变量.md",
    "services/backend/boot/src/main/resources/db/migration/V048__r15_notification_support_invariants.sql",
    "services/backend/boot/src/test/java/cc/orbexa/hhy/R15NotificationSupportMigrationTest.java",
    "tests/test_r15_database_contract.py"
  ],
  "commands_run": [
    "python3 tools/governance/hhy_governance.py active-task --format context",
    "Get-Content -Raw -LiteralPath governance/runtime/ACTIVE_TASK.json",
    "Get-Content -Raw -LiteralPath governance/task_specs/TASK-R15-002.yaml",
    "Get-Content -Raw -LiteralPath docs/00-baseline/SOURCE_OF_TRUTH.md",
    "Copy-Item -LiteralPath database\\migrations\\V048__r15_notification_support_invariants.sql -Destination services\\backend\\boot\\src\\main\\resources\\db\\migration\\V048__r15_notification_support_invariants.sql",
    "python -m pytest -q tests/test_r15_database_contract.py",
    "python3 scripts/check_db_schema.py",
    "mvn -q -f services/backend/pom.xml -DskipTests install",
    "mvn -q -f services/backend/pom.xml -pl boot -Dtest=R15NotificationSupportMigrationTest test",
    "mvn -q -Dmaven.repo.local=C:\\Users\\小白\\.m2\\repository -f services/backend/pom.xml -DskipTests install",
    "$env:MAVEN_OPTS='-Duser.home=C:\\Users\\小白'; mvn -q -f services/backend/pom.xml -DskipTests install",
    "jar tf C:\\Users\\小白\\.m2\\repository\\com\\fasterxml\\jackson\\core\\jackson-annotations\\2.21\\jackson-annotations-2.21.jar | Select-Object -First 5",
    "$env:MAVEN_OPTS='-Duser.home=C:\\Users\\小白'; mvn -e -f services/backend/pom.xml -DskipTests -pl shared-kernel compile",
    "$env:MAVEN_OPTS='-Duser.home=C:\\Users\\小白'; mvn -q -f services/backend/pom.xml -DskipTests \"-Dstyle.color=never\" -T 1 install",
    "jar tf C:\\Users\\小白\\.m2\\repository\\software\\amazon\\awssdk\\auth\\2.48.3\\auth-2.48.3.jar | Select-Object -First 5",
    "$env:MAVEN_OPTS='-Duser.home=C:\\Users\\小白'; mvn -e -f services/backend/pom.xml -DskipTests -pl access -am compile",
    "$env:MAVEN_OPTS='-Duser.home=C:\\Users\\小白'; mvn -q -f services/backend/pom.xml -DskipTests \"-Dmaven.compiler.fork=true\" \"-Dstyle.color=never\" -T 1 install",
    "$env:MAVEN_OPTS='-Duser.home=C:\\Users\\小白'; mvn -q -f services/backend/pom.xml -DskipTests \"-Dmaven.repo.local=C:\\tmp\\hhy-m2-repo\" \"-Dmaven.compiler.fork=true\" \"-Dstyle.color=never\" -T 1 install",
    "New-Item -ItemType Directory -Force -Path services\\backend\\target\\hhy-m2-repo",
    "$env:MAVEN_OPTS='-Duser.home=C:\\Users\\小白'; mvn -q -f services/backend/pom.xml -DskipTests \"-Dmaven.repo.local=services\\backend\\target\\hhy-m2-repo\" \"-Dmaven.compiler.fork=true\" \"-Dstyle.color=never\" -T 1 install",
    "Get-Command psql -ErrorAction SilentlyContinue | Select-Object Source,Version",
    "Get-Command docker -ErrorAction SilentlyContinue | Select-Object Source,Version",
    "Get-ChildItem Env: | Where-Object { $_.Name -match 'HHY_DB|PGHOST|PGPORT|PGUSER|PGPASSWORD|PGDATABASE' } | Sort-Object Name | Format-Table -AutoSize",
    "python -c \"import importlib.util; print('psycopg2=' + str(importlib.util.find_spec('psycopg2') is not None)); print('psycopg=' + str(importlib.util.find_spec('psycopg') is not None)); print('pg8000=' + str(importlib.util.find_spec('pg8000') is not None))\""
  ],
  "error_fingerprint": "JAVAC_ZIPFS_ACCESSDENIED_ON_CLOSE_JAR_ALL_LOCAL_REPOS",
  "schema": "hhy.worker-result/v5.0",
  "status": "INFRASTRUCTURE_BLOCKED",
  "summary": "TASK-R15-002 Attempt 3 used an alternate database-invariant implementation. Added V048 R15 notification/announcement/support invariant migration, exact backend runtime migration copy, DEV_ONLY rollback guard, executable SQL invariant matrix, PostgreSQL 17 Flyway/JUnit test, Python static contract test, and ADR. Static verification passed; Maven/JUnit acceptance is blocked by local Java/Maven ZipFS AccessDenied on dependency jars, not by a detected source error.",
  "task_id": "TASK-R15-002"
}
