{
  "blocker": {
    "code": "INFRA_MISSING_REQUIRED_LOCAL_TOOLCHAIN",
    "detail": "The required worker validation toolchain is not available in this shell: python/python3/py are missing, bash is missing, and Java/JAVA_HOME are missing. Because of that I could not run the governance helper, the task acceptance commands, bash syntax validation, or Android Gradle validation. Current inspected sources already contain the latest R14 attempt19 root-cause fix: scripts/run_android_emulator_gate.sh uses :app:connectedDebugAndroidTest and app-scoped JUnit output, and ReleaseCandidateSmokeTest preserves the R14 filtered-search precondition plus Compose semantics checks.",
    "paths": [
      "tools/governance/hhy_governance.py",
      "scripts/check_api_contract.py",
      "scripts/check_db_schema.py",
      "scripts/check_ui_tokens.py",
      "scripts/check_ui_visual_acceptance.py",
      "scripts/run_android_emulator_gate.sh",
      "apps/android/gradlew.bat",
      "apps/android/app/src/androidTest/java/cc/orbexa/hhy/ReleaseCandidateSmokeTest.kt"
    ],
    "resolution": "Provide python3, bash, Java/JAVA_HOME, Android SDK/adb, then rerun the governance active-task command, the four ACTIVE_TASK acceptance commands, bash -n scripts/run_android_emulator_gate.sh, and the app-scoped Android validation.",
    "worker_result_evidence": "Targeted PowerShell checks passed: PASS r14 emulator gate module scope; PASS r14 smoke journey search and compose semantics. Tool checks showed only node/npm available; python, python3, py, bash, java, javac, adb, JAVA_HOME, ANDROID_HOME, and ANDROID_SDK_ROOT were unavailable. Gradle failed with: JAVA_HOME is not set and no 'java' command could be found in your PATH."
  },
  "changed_files": [],
  "commands_run": [
    "python tools/governance/hhy_governance.py active-task --format context",
    "py tools/governance/hhy_governance.py active-task --format context",
    "python3 tools/governance/hhy_governance.py active-task --format context",
    "Get-Content -Raw -LiteralPath 'governance/runtime/ACTIVE_TASK.json'",
    "Get-Content -Raw -LiteralPath 'governance/task_specs/TASK-R14-RECOVERY-014.yaml'",
    "Get-Content -Raw -LiteralPath 'governance/STATE.yaml'",
    "rg -n \"TASK-R14-RECOVERY-014|TASK-R14-RECOVERY-013|FAILED_BOUNDED|error_fingerprint|root cause|根因|failure|FAIL\" artifacts releases docs tests scripts apps services database contracts packages config catalogs infra design/R14-UI-FROZEN",
    "Get-Content -Raw -LiteralPath 'tests/test_android_ci_gate.py'",
    "rg -n \"r14\\.conversation|r14\\.chat|assertComposeTagText|assertResourceText|clickComposeTag|longClickComposeTag|setComposeTagText|waitForUniqueComposeTag|blocked|focusManager|keyboardController|testTag|stateDescription\" apps/android/app/src/androidTest/java/cc/orbexa/hhy/ReleaseCandidateSmokeTest.kt apps/android/feature/chat/src/main/java/cc/orbexa/hhy/chat",
    "Get-Content -Raw -LiteralPath 'artifacts/validation/r14-candidate-attempt18/failure-evidence.json'",
    "Get-Content -Raw -LiteralPath 'artifacts/validation/r14-candidate-attempt19/failure-evidence.json'",
    "Get-Content -Raw -LiteralPath 'scripts/run_android_emulator_gate.sh'",
    "rg -n \"connectedDebugAndroidTest|:app:connectedDebugAndroidTest|ReleaseCandidateSmokeTest|attempt20|CR-0509|R14-CANDIDATE-20260730-020|0220185599581170af24db6ca575592da940e9f4\" scripts/run_android_emulator_gate.sh tests/test_android_ci_gate.py config/android-candidate-request.yaml config/android-automation.yaml docs/03-continuity/change-requests",
    "Get-Command bash,python,python3,py,node,npm,pwsh -ErrorAction SilentlyContinue | Select-Object Name,Source",
    "$script = Get-Content -Raw -LiteralPath 'scripts/run_android_emulator_gate.sh'; if ($script -notmatch ':app:connectedDebugAndroidTest') { throw 'missing app-scoped connectedDebugAndroidTest' }; if ($script -match \"\\n\\s+connectedDebugAndroidTest\\n\") { throw 'unscoped connectedDebugAndroidTest still present' }; if ($script -notmatch 'apps/android/app/build/outputs/androidTest-results/connected') { throw 'junit root not app-scoped' }; 'PASS r14 emulator gate module scope'",
    "$smoke = Get-Content -Raw -LiteralPath 'apps/android/app/src/androidTest/java/cc/orbexa/hhy/ReleaseCandidateSmokeTest.kt'; if ($smoke -notmatch 'setComposeTagText\\(\"r14\\.conversations\\.search\", peer\\)\\s+assertComposeTagText\\(\"r14\\.conversation\\.peer-name\", peer, 10_000\\)\\s+longClickComposeTag\\(\"r14\\.conversation\\.row\"\\)') { throw 'missing R14 reentry search before delete' }; if ($smoke -match 'assertResourceText\\(\"r14\\.conversation\\.peer-name\"') { throw 'resource text assertion still present for peer name' }; if ($smoke -match 'private fun assertResourceText\\(') { throw 'legacy assertResourceText helper still present' }; 'PASS r14 smoke journey search and compose semantics'",
    "bash -n scripts/run_android_emulator_gate.sh",
    "Get-Command java,javac,adb -ErrorAction SilentlyContinue | Select-Object Name,Source",
    "Get-ChildItem Env:ANDROID_HOME,ANDROID_SDK_ROOT,JAVA_HOME -ErrorAction SilentlyContinue | Select-Object Name,Value",
    "cmd /c apps\\android\\gradlew.bat -p apps\\android :app:tasks --all"
  ],
  "error_fingerprint": "missing_python_bash_java_android_toolchain",
  "schema": "hhy.worker-result/v5.0",
  "status": "INFRASTRUCTURE_BLOCKED",
  "summary": "TASK-R14-RECOVERY-014 could not be completed as a candidate because the validation infrastructure is missing. No files were changed. Static inspection and targeted PowerShell assertions confirm the latest R14 attempt19 fix is present, but official acceptance and Android validation cannot run in this environment.",
  "task_id": "TASK-R14-RECOVERY-014"
}
