{
  "blocker": {
    "code": "JAVAC_ACCESS_DENIED_DEPENDENCY_JAR",
    "detail": "Targeted Python regression and OpenAPI contract checks pass, but Java compile could not complete because Maven/javac fails before reaching the R15 boot module: access compile aborts with Fatal error compiling C:\\Users\\小白\\.m2\\repository\\software\\amazon\\awssdk\\auth\\2.48.3\\auth-2.48.3.jar and javac reports unable to close compiler resources. Forked javac also reports AccessDeniedException on C:\\Users\\小白\\.m2\\repository\\org\\slf4j\\jul-to-slf4j\\2.0.18\\jul-to-slf4j-2.0.18.jar plus classpath fallout.",
    "paths": [
      "C:\\Users\\小白\\.m2\\repository\\software\\amazon\\awssdk\\auth\\2.48.3\\auth-2.48.3.jar",
      "C:\\Users\\小白\\.m2\\repository\\org\\slf4j\\jul-to-slf4j\\2.0.18\\jul-to-slf4j-2.0.18.jar"
    ],
    "resolution": "Release the local Maven repository jar lock or refresh the affected dependency cache, then rerun mvn \"-Dmaven.repo.local=C:/Users/小白/.m2/repository\" -pl boot -am -DskipTests compile and the targeted boot tests.",
    "worker_result_evidence": "python3 -m pytest -q tests/test_r15_backend_operation_coverage.py => 4 passed; python3 scripts/check_api_contract.py => API_CONTRACT_OK client=131 admin=184 websocket=12 runtime_hashes=PASS; mvn boot compile => hhy-access FAILURE before hhy-content/hhy-boot with Fatal error compiling auth-2.48.3.jar"
  },
  "changed_files": [
    "services/backend/content/src/main/java/cc/orbexa/hhy/content/R15Contracts.java",
    "services/backend/content/src/main/java/cc/orbexa/hhy/content/R15Store.java",
    "services/backend/content/src/main/java/cc/orbexa/hhy/content/R15PostgresStore.java",
    "services/backend/content/src/main/java/cc/orbexa/hhy/content/R15Service.java",
    "services/backend/boot/src/main/java/cc/orbexa/hhy/boot/user/R15UserController.java",
    "services/backend/boot/src/main/java/cc/orbexa/hhy/boot/admin/R15AdminController.java",
    "services/backend/boot/src/main/java/cc/orbexa/hhy/boot/user/UserSelfServiceController.java",
    "services/backend/boot/src/test/java/cc/orbexa/hhy/access/user/UserSecurityWebSecurityTest.java",
    "tests/test_r15_backend_operation_coverage.py"
  ],
  "commands_run": [
    "python3 tools/governance/hhy_governance.py active-task --format context",
    "Get-Content -Raw governance/runtime/ACTIVE_TASK.json",
    "rg -n \"operationId|TASK-R15-003|R15|TODO|Mock|mock\" contracts catalogs docs services/backend tests packages/api-client packages/domain-types",
    "rg --files contracts catalogs docs services/backend tests packages/api-client packages/domain-types",
    "Get-Content -Raw scripts/check_api_contract.py",
    "python3 scripts/check_api_contract.py",
    "rg -n \"notification|announcement|support|ticket|report|appeal|invalid-feedback|read-all|content-reports|chat-reports|help/articles|R15\" services/backend -g \"*.java\" -g \"*.sql\" -g \"*.yml\" -g \"*.yaml\"",
    "rg -n \"notificationGetNotifications|notificationPostNotificationsByIdRead|notificationPostNotificationsReadAll|notificationGetAnnouncements|notificationGetAnnouncementsById|supportGetHelpArticles|supportGetHelpArticlesById|supportPostSupportTickets|supportGetSupportTickets|supportGetSupportTicketsById|supportPostSupportTicketsByIdMessages|contentPostContentsByIdReport|contentPostContentsByIdInvalidFeedback|admin.*Report|admin.*Appeal|admin.*Support|chat.*Report\" contracts/openapi.yaml contracts/admin-openapi.yaml catalogs/api_endpoints.csv catalogs/admin_api_endpoints.csv contracts/operation-error-matrix.csv packages/api-client/src/client.generated.ts packages/api-client/src/admin.generated.ts",
    "Get-Content -Raw tests/test_r15_notification_support_postgres.py",
    "Get-Content -Raw services/backend/access/src/main/java/cc/orbexa/hhy/access/user/UserAuthContracts.java",
    "Get-Content -Raw services/backend/access/src/main/java/cc/orbexa/hhy/access/user/UserAuthService.java",
    "Get-Content -Raw services/backend/access/src/main/java/cc/orbexa/hhy/access/user/UserAuthStore.java",
    "Get-Content -Raw services/backend/boot/src/main/java/cc/orbexa/hhy/boot/user/UserAuthController.java",
    "Get-Content -Raw services/backend/boot/src/main/java/cc/orbexa/hhy/boot/user/UserSelfServiceController.java",
    "Get-Content -Raw services/backend/boot/src/main/java/cc/orbexa/hhy/boot/admin/R12ReviewController.java",
    "Get-Content -Raw services/backend/content/src/main/java/cc/orbexa/hhy/content/R12ReviewService.java",
    "Get-Content -Raw services/backend/content/src/main/java/cc/orbexa/hhy/content/R12ReviewPostgresStore.java",
    "Get-Content -Raw services/backend/boot/src/main/java/cc/orbexa/hhy/boot/user/ContentController.java",
    "Get-Content -Raw services/backend/boot/src/main/java/cc/orbexa/hhy/boot/user/R13Controller.java",
    "Get-Content -Raw services/backend/boot/src/main/java/cc/orbexa/hhy/boot/user/R14Controller.java",
    "Get-Content -Raw services/backend/content/src/main/java/cc/orbexa/hhy/content/R13Contracts.java; Get-Content -Raw services/backend/content/src/main/java/cc/orbexa/hhy/content/R13Service.java; Get-Content -Raw services/backend/content/src/main/java/cc/orbexa/hhy/content/R14Contracts.java; Get-Content -Raw services/backend/content/src/main/java/cc/orbexa/hhy/content/R14Service.java",
    "rg -n \"CREATE TABLE hhy\\.(notifications|notification_templates|notification_deliveries|push_tokens|announcements|announcement_reads|support_tickets|ticket_messages|ticket_attachments|ticket_status_logs|help|content_reports|content_appeals|chat_reports|admin_operation_logs|outbox_events)|ALTER TABLE hhy\\.(notifications|support_tickets|announcements|ticket_messages|content_reports|content_appeals|chat_reports)\" services/backend/boot/src/main/resources/db/migration -g \"*.sql\"",
    "Get-Content services/backend/boot/src/main/resources/db/migration/V003__content_identity_and_communication.sql | Select-Object -Skip 320 -First 310",
    "Get-Content services/backend/boot/src/main/resources/db/migration/V002__access_admin_and_platform.sql | Select-Object -Skip 250 -First 260",
    "mvn \"-Dmaven.repo.local=C:/Users/小白/.m2/repository\" -pl boot -am -DskipTests compile",
    "python3 -m pytest -q tests/test_r15_backend_operation_coverage.py",
    "python3 scripts/check_api_contract.py"
  ],
  "error_fingerprint": "JAVAC_ACCESS_DENIED_AWSSDK_AUTH_2_48_3",
  "schema": "hhy.worker-result/v5.0",
  "status": "INFRASTRUCTURE_BLOCKED",
  "summary": "Implemented R15 backend operation coverage slice for notification read/list/read-all, announcements, content report, support tickets, admin chat report decisions, admin support operations, and related idempotency/audit/Outbox storage paths. Added static regression coverage for the 25-operation R15 scope and removed the duplicate old support-create mapping. Targeted Python regression and OpenAPI contract check pass, but Java compile is infrastructure-blocked by local Maven dependency jar access errors before boot compilation completes.",
  "task_id": "TASK-R15-003"
}
